[
  {
    "CollectedAt": "2026-04-26T23:41:15.911703+00:00",
    "Collector": "SharePointOneDrive",
    "Data": {
      "CreatedDateTime": "2026-04-02 21:54:17.810000+00:00",
      "DiscoveryMethod": "fallback",
      "IsRoot": false,
      "IsStale": false,
      "LastModifiedDateTime": "2026-04-14 16:38:52+00:00",
      "SensitivityLabel": "",
      "SensitivityLabelId": "",
      "SiteId": "mngenvmcap250477.sharepoint.com,0d1e93c0-0072-4943-bd23-fd02d8fe7dd1,20d346f5-c835-4a99-99ae-36e7756f234e",
      "SiteName": "Contoso",
      "StaleDays": 180,
      "WebUrl": "https://mngenvmcap250477.sharepoint.com/sites/Contoso"
    },
    "Description": "SharePoint site: Contoso",
    "EvidenceId": "2109328b-395c-5492-967f-7db1a3313508",
    "EvidenceType": "spo-site-inventory",
    "RawReference": null,
    "ResourceId": "mngenvmcap250477.sharepoint.com,0d1e93c0-0072-4943-bd23-fd02d8fe7dd1,20d346f5-c835-4a99-99ae-36e7756f234e",
    "ResourceType": "SharePointSite",
    "Source": "Entra"
  },
  {
    "CollectedAt": "2026-04-26T23:41:15.911345+00:00",
    "Collector": "SharePointOneDrive",
    "Data": {
      "CreatedDateTime": "2024-09-04 16:33:40.053000+00:00",
      "DiscoveryMethod": "fallback",
      "IsRoot": false,
      "IsStale": false,
      "LastModifiedDateTime": "2026-04-10 22:40:03+00:00",
      "SensitivityLabel": "",
      "SensitivityLabelId": "",
      "SiteId": "mngenvmcap250477.sharepoint.com,320041f7-8c60-40e1-8582-ebb8052fb9b0,beec520c-13e5-4b55-9fb4-5d5cf4c5294b",
      "SiteName": "Communication site",
      "StaleDays": 180,
      "WebUrl": "https://mngenvmcap250477.sharepoint.com"
    },
    "Description": "SharePoint site: Communication site",
    "EvidenceId": "5519bb72-7546-55a8-bc8d-37f531e224f4",
    "EvidenceType": "spo-site-inventory",
    "RawReference": null,
    "ResourceId": "mngenvmcap250477.sharepoint.com,320041f7-8c60-40e1-8582-ebb8052fb9b0,beec520c-13e5-4b55-9fb4-5d5cf4c5294b",
    "ResourceType": "SharePointSite",
    "Source": "Entra"
  },
  {
    "CollectedAt": "2026-04-26T23:41:15.911654+00:00",
    "Collector": "SharePointOneDrive",
    "Data": {
      "CreatedDateTime": "2025-01-22 19:15:01.577000+00:00",
      "DiscoveryMethod": "fallback",
      "IsRoot": false,
      "IsStale": false,
      "LastModifiedDateTime": "2026-04-03 00:34:22+00:00",
      "SensitivityLabel": "",
      "SensitivityLabelId": "",
      "SiteId": "mngenvmcap250477.sharepoint.com,4a236c60-a51c-486d-ae1e-2b45f09ae8d9,b759fb76-2ffe-4251-bc23-f5a3d3fbf26e",
      "SiteName": "M365GroupForPurview02",
      "StaleDays": 180,
      "WebUrl": "https://mngenvmcap250477.sharepoint.com/sites/M365GroupForPurview02"
    },
    "Description": "SharePoint site: M365GroupForPurview02",
    "EvidenceId": "8e4ba0e0-9e83-5c7e-9aff-e1b3e4aff5e2",
    "EvidenceType": "spo-site-inventory",
    "RawReference": null,
    "ResourceId": "mngenvmcap250477.sharepoint.com,4a236c60-a51c-486d-ae1e-2b45f09ae8d9,b759fb76-2ffe-4251-bc23-f5a3d3fbf26e",
    "ResourceType": "SharePointSite",
    "Source": "Entra"
  },
  {
    "CollectedAt": "2026-04-26T23:41:15.911528+00:00",
    "Collector": "SharePointOneDrive",
    "Data": {
      "CreatedDateTime": "2025-01-22 19:14:34.370000+00:00",
      "DiscoveryMethod": "fallback",
      "IsRoot": false,
      "IsStale": false,
      "LastModifiedDateTime": "2026-04-03 22:53:11+00:00",
      "SensitivityLabel": "",
      "SensitivityLabelId": "",
      "SiteId": "mngenvmcap250477.sharepoint.com,4eb63c8d-e5b8-456b-bcba-b8a6fca189b9,b759fb76-2ffe-4251-bc23-f5a3d3fbf26e",
      "SiteName": "M365GroupForPurview01",
      "StaleDays": 180,
      "WebUrl": "https://mngenvmcap250477.sharepoint.com/sites/M365GroupForPurview01"
    },
    "Description": "SharePoint site: M365GroupForPurview01",
    "EvidenceId": "852c292d-88ea-5f9f-95f3-ed7a8cfef4bc",
    "EvidenceType": "spo-site-inventory",
    "RawReference": null,
    "ResourceId": "mngenvmcap250477.sharepoint.com,4eb63c8d-e5b8-456b-bcba-b8a6fca189b9,b759fb76-2ffe-4251-bc23-f5a3d3fbf26e",
    "ResourceType": "SharePointSite",
    "Source": "Entra"
  },
  {
    "CollectedAt": "2026-04-26T23:41:15.911599+00:00",
    "Collector": "SharePointOneDrive",
    "Data": {
      "CreatedDateTime": "2025-08-13 00:23:40.423000+00:00",
      "DiscoveryMethod": "fallback",
      "IsRoot": false,
      "IsStale": false,
      "LastModifiedDateTime": "2026-04-03 00:34:22+00:00",
      "SensitivityLabel": "",
      "SensitivityLabelId": "",
      "SiteId": "mngenvmcap250477.sharepoint.com,55aa728a-f677-4c0e-a69a-0e0ba6cc0ec3,16d2d929-d699-4ffa-8196-92b9e8e9267c",
      "SiteName": "MFabric",
      "StaleDays": 180,
      "WebUrl": "https://mngenvmcap250477.sharepoint.com/sites/MFabric"
    },
    "Description": "SharePoint site: MFabric",
    "EvidenceId": "b58b560e-c971-59e5-a622-2c09a932ac1b",
    "EvidenceType": "spo-site-inventory",
    "RawReference": null,
    "ResourceId": "mngenvmcap250477.sharepoint.com,55aa728a-f677-4c0e-a69a-0e0ba6cc0ec3,16d2d929-d699-4ffa-8196-92b9e8e9267c",
    "ResourceType": "SharePointSite",
    "Source": "Entra"
  },
  {
    "CollectedAt": "2026-04-26T23:41:15.911750+00:00",
    "Collector": "SharePointOneDrive",
    "Data": {
      "CreatedDateTime": "2024-09-04 16:37:29.140000+00:00",
      "DiscoveryMethod": "fallback",
      "IsRoot": false,
      "IsStale": false,
      "LastModifiedDateTime": "2026-04-14 16:38:53+00:00",
      "SensitivityLabel": "",
      "SensitivityLabelId": "",
      "SiteId": "mngenvmcap250477.sharepoint.com,c736c68e-ac38-434e-a246-8421dac43ae4,16ed3e33-6afc-40bc-aef9-238c68bd58fb",
      "SiteName": "All Company",
      "StaleDays": 180,
      "WebUrl": "https://mngenvmcap250477.sharepoint.com/sites/allcompany"
    },
    "Description": "SharePoint site: All Company",
    "EvidenceId": "be5f1663-9183-582f-8a53-1c3e60c198c9",
    "EvidenceType": "spo-site-inventory",
    "RawReference": null,
    "ResourceId": "mngenvmcap250477.sharepoint.com,c736c68e-ac38-434e-a246-8421dac43ae4,16ed3e33-6afc-40bc-aef9-238c68bd58fb",
    "ResourceType": "SharePointSite",
    "Source": "Entra"
  }
]