[
  {
    "CollectedAt": "2026-04-26T23:39:58.022218+00:00",
    "Collector": "AzureRedisIoTLogic",
    "Data": {
      "ChangedTime": "2025-12-15 20:38:57.384039+00:00",
      "CreatedTime": "2025-12-05 20:18:19.949609+00:00",
      "HasAccessControl": false,
      "IntegrationAccountId": "",
      "Location": "eastus",
      "ManagedIdentityType": "SystemAssigned",
      "Name": "CreateSNOWRecord",
      "ProvisioningState": "Succeeded",
      "SkuName": "",
      "State": "Enabled",
      "SubscriptionId": "8054e434-49e0-4a21-bbea-3fee1c872b88",
      "SubscriptionName": "Security",
      "Version": "08584357757481376654",
      "WorkflowId": "/subscriptions/8054e434-49e0-4a21-bbea-3fee1c872b88/resourceGroups/RG-LogAnalyticsWorkspace/providers/Microsoft.Logic/workflows/CreateSNOWRecord"
    },
    "Description": "Logic App: CreateSNOWRecord",
    "EvidenceId": "c73bd58d-3810-5f18-8da5-d0c44469aa13",
    "EvidenceType": "azure-logic-app",
    "RawReference": null,
    "ResourceId": "/subscriptions/8054e434-49e0-4a21-bbea-3fee1c872b88/resourceGroups/RG-LogAnalyticsWorkspace/providers/Microsoft.Logic/workflows/CreateSNOWRecord",
    "ResourceType": "LogicApp",
    "Source": "Azure"
  },
  {
    "CollectedAt": "2026-04-26T23:39:58.022467+00:00",
    "Collector": "AzureRedisIoTLogic",
    "Data": {
      "ChangedTime": "2025-12-15 20:35:01.186342+00:00",
      "CreatedTime": "2025-12-05 20:15:28.594064+00:00",
      "HasAccessControl": false,
      "IntegrationAccountId": "",
      "Location": "eastus",
      "ManagedIdentityType": "SystemAssigned",
      "Name": "SNOW-CreateAndUpdateIncident",
      "ProvisioningState": "Succeeded",
      "SkuName": "",
      "State": "Enabled",
      "SubscriptionId": "8054e434-49e0-4a21-bbea-3fee1c872b88",
      "SubscriptionName": "Security",
      "Version": "08584357759843097971",
      "WorkflowId": "/subscriptions/8054e434-49e0-4a21-bbea-3fee1c872b88/resourceGroups/RG-LogAnalyticsWorkspace/providers/Microsoft.Logic/workflows/SNOW-CreateAndUpdateIncident"
    },
    "Description": "Logic App: SNOW-CreateAndUpdateIncident",
    "EvidenceId": "bc5248f1-46ff-58b3-96f0-88863b4c3c87",
    "EvidenceType": "azure-logic-app",
    "RawReference": null,
    "ResourceId": "/subscriptions/8054e434-49e0-4a21-bbea-3fee1c872b88/resourceGroups/RG-LogAnalyticsWorkspace/providers/Microsoft.Logic/workflows/SNOW-CreateAndUpdateIncident",
    "ResourceType": "LogicApp",
    "Source": "Azure"
  }
]