[
  {
    "CollectedAt": "2026-04-26T23:33:12.981313+00:00",
    "Collector": "EntraSecurityPolicies",
    "Data": {
      "AllowedCloudEndpoints": [],
      "HasDefault": false
    },
    "Description": "Cross-tenant access policy",
    "EvidenceId": "ee6e04b5-21fd-53e5-b579-2d7a3cae656e",
    "EvidenceType": "entra-cross-tenant-policy",
    "RawReference": null,
    "ResourceId": "",
    "ResourceType": "CrossTenantPolicy",
    "Source": "Entra"
  }
]