[
  {
    "CollectedAt": "2026-04-26T23:39:59.803209+00:00",
    "Collector": "AzureAIServices",
    "Data": {
      "AccountName": "fedramp-high-openai",
      "ContentFilter": "Microsoft.DefaultV2",
      "DeploymentId": "/subscriptions/d33fc1a7-56aa-4c30-a4a0-98b1e04fafd0/resourceGroups/RG-AzureAIFoundary-FedRAMP-High/providers/Microsoft.CognitiveServices/accounts/fedramp-high-openai/deployments/gpt-4o",
      "DeploymentName": "gpt-4o",
      "ModelFormat": "OpenAI",
      "ModelName": "gpt-4o",
      "ModelVersion": "2024-11-20",
      "ProvisioningState": "Succeeded",
      "RateLimits": true,
      "ScaleType": "",
      "SubscriptionId": "d33fc1a7-56aa-4c30-a4a0-98b1e04fafd0",
      "SubscriptionName": "AI"
    },
    "Description": "AI Deployment: gpt-4o on fedramp-high-openai",
    "EvidenceId": "24c921f5-13e5-5982-a00f-1188f716922e",
    "EvidenceType": "azure-ai-deployment",
    "RawReference": null,
    "ResourceId": "/subscriptions/d33fc1a7-56aa-4c30-a4a0-98b1e04fafd0/resourceGroups/RG-AzureAIFoundary-FedRAMP-High/providers/Microsoft.CognitiveServices/accounts/fedramp-high-openai/deployments/gpt-4o",
    "ResourceType": "AIDeployment",
    "Source": "Azure"
  },
  {
    "CollectedAt": "2026-04-26T23:39:59.803268+00:00",
    "Collector": "AzureAIServices",
    "Data": {
      "AccountName": "fedramp-high-openai",
      "ContentFilter": "Microsoft.DefaultV2",
      "DeploymentId": "/subscriptions/d33fc1a7-56aa-4c30-a4a0-98b1e04fafd0/resourceGroups/RG-AzureAIFoundary-FedRAMP-High/providers/Microsoft.CognitiveServices/accounts/fedramp-high-openai/deployments/gpt-4o-mini-tts",
      "DeploymentName": "gpt-4o-mini-tts",
      "ModelFormat": "OpenAI",
      "ModelName": "gpt-4o-mini-tts",
      "ModelVersion": "2025-03-20",
      "ProvisioningState": "Succeeded",
      "RateLimits": true,
      "ScaleType": "",
      "SubscriptionId": "d33fc1a7-56aa-4c30-a4a0-98b1e04fafd0",
      "SubscriptionName": "AI"
    },
    "Description": "AI Deployment: gpt-4o-mini-tts on fedramp-high-openai",
    "EvidenceId": "fe2140bf-2585-5586-b2ee-685dd2480a44",
    "EvidenceType": "azure-ai-deployment",
    "RawReference": null,
    "ResourceId": "/subscriptions/d33fc1a7-56aa-4c30-a4a0-98b1e04fafd0/resourceGroups/RG-AzureAIFoundary-FedRAMP-High/providers/Microsoft.CognitiveServices/accounts/fedramp-high-openai/deployments/gpt-4o-mini-tts",
    "ResourceType": "AIDeployment",
    "Source": "Azure"
  },
  {
    "CollectedAt": "2026-04-26T23:39:59.803127+00:00",
    "Collector": "AzureAIServices",
    "Data": {
      "AccountName": "fedramp-high-openai",
      "ContentFilter": "Microsoft.DefaultV2",
      "DeploymentId": "/subscriptions/d33fc1a7-56aa-4c30-a4a0-98b1e04fafd0/resourceGroups/RG-AzureAIFoundary-FedRAMP-High/providers/Microsoft.CognitiveServices/accounts/fedramp-high-openai/deployments/gpt-5-mini",
      "DeploymentName": "gpt-5-mini",
      "ModelFormat": "OpenAI",
      "ModelName": "gpt-5-mini",
      "ModelVersion": "2025-08-07",
      "ProvisioningState": "Succeeded",
      "RateLimits": true,
      "ScaleType": "",
      "SubscriptionId": "d33fc1a7-56aa-4c30-a4a0-98b1e04fafd0",
      "SubscriptionName": "AI"
    },
    "Description": "AI Deployment: gpt-5-mini on fedramp-high-openai",
    "EvidenceId": "eb5656d3-679b-582b-9aad-d5618be550aa",
    "EvidenceType": "azure-ai-deployment",
    "RawReference": null,
    "ResourceId": "/subscriptions/d33fc1a7-56aa-4c30-a4a0-98b1e04fafd0/resourceGroups/RG-AzureAIFoundary-FedRAMP-High/providers/Microsoft.CognitiveServices/accounts/fedramp-high-openai/deployments/gpt-5-mini",
    "ResourceType": "AIDeployment",
    "Source": "Azure"
  },
  {
    "CollectedAt": "2026-04-26T23:39:59.803320+00:00",
    "Collector": "AzureAIServices",
    "Data": {
      "AccountName": "fedramp-high-openai",
      "ContentFilter": "Microsoft.DefaultV2",
      "DeploymentId": "/subscriptions/d33fc1a7-56aa-4c30-a4a0-98b1e04fafd0/resourceGroups/RG-AzureAIFoundary-FedRAMP-High/providers/Microsoft.CognitiveServices/accounts/fedramp-high-openai/deployments/sora",
      "DeploymentName": "sora",
      "ModelFormat": "OpenAI",
      "ModelName": "sora",
      "ModelVersion": "2025-05-02",
      "ProvisioningState": "Disabled",
      "RateLimits": true,
      "ScaleType": "",
      "SubscriptionId": "d33fc1a7-56aa-4c30-a4a0-98b1e04fafd0",
      "SubscriptionName": "AI"
    },
    "Description": "AI Deployment: sora on fedramp-high-openai",
    "EvidenceId": "d1b1c6f1-23f0-5319-98c7-34e773ec6c32",
    "EvidenceType": "azure-ai-deployment",
    "RawReference": null,
    "ResourceId": "/subscriptions/d33fc1a7-56aa-4c30-a4a0-98b1e04fafd0/resourceGroups/RG-AzureAIFoundary-FedRAMP-High/providers/Microsoft.CognitiveServices/accounts/fedramp-high-openai/deployments/sora",
    "ResourceType": "AIDeployment",
    "Source": "Azure"
  },
  {
    "CollectedAt": "2026-04-26T23:39:59.802922+00:00",
    "Collector": "AzureAIServices",
    "Data": {
      "AccountName": "fedramp-high-openai",
      "ContentFilter": "Microsoft.DefaultV2",
      "DeploymentId": "/subscriptions/d33fc1a7-56aa-4c30-a4a0-98b1e04fafd0/resourceGroups/RG-AzureAIFoundary-FedRAMP-High/providers/Microsoft.CognitiveServices/accounts/fedramp-high-openai/deployments/text-embedding-3-small",
      "DeploymentName": "text-embedding-3-small",
      "ModelFormat": "OpenAI",
      "ModelName": "text-embedding-3-small",
      "ModelVersion": "1",
      "ProvisioningState": "Succeeded",
      "RateLimits": true,
      "ScaleType": "",
      "SubscriptionId": "d33fc1a7-56aa-4c30-a4a0-98b1e04fafd0",
      "SubscriptionName": "AI"
    },
    "Description": "AI Deployment: text-embedding-3-small on fedramp-high-openai",
    "EvidenceId": "0b1c4f55-2fda-5aaf-8ef5-061e8097251c",
    "EvidenceType": "azure-ai-deployment",
    "RawReference": null,
    "ResourceId": "/subscriptions/d33fc1a7-56aa-4c30-a4a0-98b1e04fafd0/resourceGroups/RG-AzureAIFoundary-FedRAMP-High/providers/Microsoft.CognitiveServices/accounts/fedramp-high-openai/deployments/text-embedding-3-small",
    "ResourceType": "AIDeployment",
    "Source": "Azure"
  }
]