[
  {
    "CollectedAt": "2026-04-26T23:39:32.853611+00:00",
    "Collector": "AzureMonitoring",
    "Data": {
      "ActionGroupId": "/subscriptions/0EB177BD-28B1-44DA-B683-1508E1268AEE/resourceGroups/Default-ActivityLogAlerts/providers/microsoft.insights/actionGroups/AGOwner",
      "EmailReceiverCount": 1,
      "Enabled": true,
      "Name": "AGOwner",
      "SmsReceiverCount": 0,
      "SubscriptionId": "0eb177bd-28b1-44da-b683-1508e1268aee",
      "SubscriptionName": "Prod",
      "TotalReceivers": 1,
      "WebhookReceiverCount": 0
    },
    "Description": "Action group: AGOwner",
    "EvidenceId": "45644c38-15cd-596c-acc6-bb046073d386",
    "EvidenceType": "azure-action-group",
    "RawReference": null,
    "ResourceId": "/subscriptions/0EB177BD-28B1-44DA-B683-1508E1268AEE/resourceGroups/Default-ActivityLogAlerts/providers/microsoft.insights/actionGroups/AGOwner",
    "ResourceType": "ActionGroup",
    "Source": "Azure"
  },
  {
    "CollectedAt": "2026-04-26T23:39:48.145473+00:00",
    "Collector": "AzureMonitoring",
    "Data": {
      "ActionGroupId": "/subscriptions/8054E434-49E0-4A21-BBEA-3FEE1C872B88/resourceGroups/Default-ActivityLogAlerts/providers/microsoft.insights/actionGroups/AGOwner",
      "EmailReceiverCount": 1,
      "Enabled": true,
      "Name": "AGOwner",
      "SmsReceiverCount": 0,
      "SubscriptionId": "8054e434-49e0-4a21-bbea-3fee1c872b88",
      "SubscriptionName": "Security",
      "TotalReceivers": 1,
      "WebhookReceiverCount": 0
    },
    "Description": "Action group: AGOwner",
    "EvidenceId": "8658dc57-668a-5820-a1a4-a9f46afd6090",
    "EvidenceType": "azure-action-group",
    "RawReference": null,
    "ResourceId": "/subscriptions/8054E434-49E0-4A21-BBEA-3FEE1C872B88/resourceGroups/Default-ActivityLogAlerts/providers/microsoft.insights/actionGroups/AGOwner",
    "ResourceType": "ActionGroup",
    "Source": "Azure"
  },
  {
    "CollectedAt": "2026-04-26T23:39:48.145675+00:00",
    "Collector": "AzureMonitoring",
    "Data": {
      "ActionGroupId": "/subscriptions/8054E434-49E0-4A21-BBEA-3FEE1C872B88/resourceGroups/RG-LogAnalyticsWorkspace/providers/microsoft.insights/actionGroups/Application Insights Smart Detection",
      "EmailReceiverCount": 0,
      "Enabled": true,
      "Name": "Application Insights Smart Detection",
      "SmsReceiverCount": 0,
      "SubscriptionId": "8054e434-49e0-4a21-bbea-3fee1c872b88",
      "SubscriptionName": "Security",
      "TotalReceivers": 0,
      "WebhookReceiverCount": 0
    },
    "Description": "Action group: Application Insights Smart Detection",
    "EvidenceId": "814791a8-06ac-5edc-9d23-93c8d9ac8b61",
    "EvidenceType": "azure-action-group",
    "RawReference": null,
    "ResourceId": "/subscriptions/8054E434-49E0-4A21-BBEA-3FEE1C872B88/resourceGroups/RG-LogAnalyticsWorkspace/providers/microsoft.insights/actionGroups/Application Insights Smart Detection",
    "ResourceType": "ActionGroup",
    "Source": "Azure"
  },
  {
    "CollectedAt": "2026-04-26T23:39:59.269465+00:00",
    "Collector": "AzureMonitoring",
    "Data": {
      "ActionGroupId": "/subscriptions/9154CDCB-5A52-452A-B1E7-483BE9EEE6D2/resourceGroups/Default-ActivityLogAlerts/providers/microsoft.insights/actionGroups/AGOwner",
      "EmailReceiverCount": 1,
      "Enabled": true,
      "Name": "AGOwner",
      "SmsReceiverCount": 0,
      "SubscriptionId": "9154cdcb-5a52-452a-b1e7-483be9eee6d2",
      "SubscriptionName": "Infra",
      "TotalReceivers": 1,
      "WebhookReceiverCount": 0
    },
    "Description": "Action group: AGOwner",
    "EvidenceId": "03c87874-ecd1-5c68-9967-30d71b00bae7",
    "EvidenceType": "azure-action-group",
    "RawReference": null,
    "ResourceId": "/subscriptions/9154CDCB-5A52-452A-B1E7-483BE9EEE6D2/resourceGroups/Default-ActivityLogAlerts/providers/microsoft.insights/actionGroups/AGOwner",
    "ResourceType": "ActionGroup",
    "Source": "Azure"
  },
  {
    "CollectedAt": "2026-04-26T23:39:59.269617+00:00",
    "Collector": "AzureMonitoring",
    "Data": {
      "ActionGroupId": "/subscriptions/9154CDCB-5A52-452A-B1E7-483BE9EEE6D2/resourceGroups/rg-ecma2-poc/providers/microsoft.insights/actionGroups/Application Insights Smart Detection",
      "EmailReceiverCount": 0,
      "Enabled": true,
      "Name": "Application Insights Smart Detection",
      "SmsReceiverCount": 0,
      "SubscriptionId": "9154cdcb-5a52-452a-b1e7-483be9eee6d2",
      "SubscriptionName": "Infra",
      "TotalReceivers": 0,
      "WebhookReceiverCount": 0
    },
    "Description": "Action group: Application Insights Smart Detection",
    "EvidenceId": "6dc1eae5-572c-5874-8628-9cea7e607636",
    "EvidenceType": "azure-action-group",
    "RawReference": null,
    "ResourceId": "/subscriptions/9154CDCB-5A52-452A-B1E7-483BE9EEE6D2/resourceGroups/rg-ecma2-poc/providers/microsoft.insights/actionGroups/Application Insights Smart Detection",
    "ResourceType": "ActionGroup",
    "Source": "Azure"
  },
  {
    "CollectedAt": "2026-04-26T23:40:12.843271+00:00",
    "Collector": "AzureMonitoring",
    "Data": {
      "ActionGroupId": "/subscriptions/D33FC1A7-56AA-4C30-A4A0-98B1E04FAFD0/resourceGroups/Default-ActivityLogAlerts/providers/microsoft.insights/actionGroups/AGOwner",
      "EmailReceiverCount": 1,
      "Enabled": true,
      "Name": "AGOwner",
      "SmsReceiverCount": 0,
      "SubscriptionId": "d33fc1a7-56aa-4c30-a4a0-98b1e04fafd0",
      "SubscriptionName": "AI",
      "TotalReceivers": 1,
      "WebhookReceiverCount": 0
    },
    "Description": "Action group: AGOwner",
    "EvidenceId": "82f5c135-646c-5821-941b-8303b7331af9",
    "EvidenceType": "azure-action-group",
    "RawReference": null,
    "ResourceId": "/subscriptions/D33FC1A7-56AA-4C30-A4A0-98B1E04FAFD0/resourceGroups/Default-ActivityLogAlerts/providers/microsoft.insights/actionGroups/AGOwner",
    "ResourceType": "ActionGroup",
    "Source": "Azure"
  },
  {
    "CollectedAt": "2026-04-26T23:40:12.843438+00:00",
    "Collector": "AzureMonitoring",
    "Data": {
      "ActionGroupId": "/subscriptions/D33FC1A7-56AA-4C30-A4A0-98B1E04FAFD0/resourceGroups/RG-AzureAIFoundary-FedRAMP-High/providers/microsoft.insights/actionGroups/Application Insights Smart Detection",
      "EmailReceiverCount": 0,
      "Enabled": true,
      "Name": "Application Insights Smart Detection",
      "SmsReceiverCount": 0,
      "SubscriptionId": "d33fc1a7-56aa-4c30-a4a0-98b1e04fafd0",
      "SubscriptionName": "AI",
      "TotalReceivers": 0,
      "WebhookReceiverCount": 0
    },
    "Description": "Action group: Application Insights Smart Detection",
    "EvidenceId": "28bb3b48-6245-5167-87c8-8c9fede01f51",
    "EvidenceType": "azure-action-group",
    "RawReference": null,
    "ResourceId": "/subscriptions/D33FC1A7-56AA-4C30-A4A0-98B1E04FAFD0/resourceGroups/RG-AzureAIFoundary-FedRAMP-High/providers/microsoft.insights/actionGroups/Application Insights Smart Detection",
    "ResourceType": "ActionGroup",
    "Source": "Azure"
  }
]