[
  {
    "CollectedAt": "2026-04-26T23:39:58.244500+00:00",
    "Collector": "AzureContainers",
    "Data": {
      "ContainerAppId": "/subscriptions/9154cdcb-5a52-452a-b1e7-483be9eee6d2/resourceGroups/RG-ADLS-Governance-Retention/providers/Microsoft.App/containerapps/ca-api-ia6nebdpvu5bm",
      "ContainerCount": 1,
      "IngressAllowInsecure": false,
      "IngressEnabled": true,
      "IngressExternal": true,
      "IngressTargetPort": 8000,
      "IngressTransport": "Auto",
      "Location": "Canada Central",
      "ManagedEnvironmentId": "/subscriptions/9154cdcb-5a52-452a-b1e7-483be9eee6d2/resourceGroups/RG-ADLS-Governance-Retention/providers/Microsoft.App/managedEnvironments/cae-ia6nebdpvu5bm",
      "ManagedIdentityType": "UserAssigned",
      "Name": "ca-api-ia6nebdpvu5bm",
      "ProvisioningState": "Succeeded",
      "ScaleMaxReplicas": 3,
      "ScaleMinReplicas": 0,
      "SubscriptionId": "9154cdcb-5a52-452a-b1e7-483be9eee6d2",
      "SubscriptionName": "Infra"
    },
    "Description": "Container App: ca-api-ia6nebdpvu5bm",
    "EvidenceId": "325460c9-ff4a-5a0a-ba0e-9e93a5ede3f4",
    "EvidenceType": "azure-container-app",
    "RawReference": null,
    "ResourceId": "/subscriptions/9154cdcb-5a52-452a-b1e7-483be9eee6d2/resourceGroups/RG-ADLS-Governance-Retention/providers/Microsoft.App/containerapps/ca-api-ia6nebdpvu5bm",
    "ResourceType": "Microsoft.App/containerApps",
    "Source": "Azure"
  },
  {
    "CollectedAt": "2026-04-26T23:39:58.244313+00:00",
    "Collector": "AzureContainers",
    "Data": {
      "ContainerAppId": "/subscriptions/9154cdcb-5a52-452a-b1e7-483be9eee6d2/resourceGroups/RG-ADLS-Governance-Retention/providers/Microsoft.App/containerapps/ca-spa-ia6nebdpvu5bm",
      "ContainerCount": 1,
      "IngressAllowInsecure": false,
      "IngressEnabled": true,
      "IngressExternal": true,
      "IngressTargetPort": 8080,
      "IngressTransport": "Auto",
      "Location": "Canada Central",
      "ManagedEnvironmentId": "/subscriptions/9154cdcb-5a52-452a-b1e7-483be9eee6d2/resourceGroups/RG-ADLS-Governance-Retention/providers/Microsoft.App/managedEnvironments/cae-ia6nebdpvu5bm",
      "ManagedIdentityType": "UserAssigned",
      "Name": "ca-spa-ia6nebdpvu5bm",
      "ProvisioningState": "Succeeded",
      "ScaleMaxReplicas": 3,
      "ScaleMinReplicas": 0,
      "SubscriptionId": "9154cdcb-5a52-452a-b1e7-483be9eee6d2",
      "SubscriptionName": "Infra"
    },
    "Description": "Container App: ca-spa-ia6nebdpvu5bm",
    "EvidenceId": "3c6e02a4-0a1d-58fe-905d-0ba5c880e093",
    "EvidenceType": "azure-container-app",
    "RawReference": null,
    "ResourceId": "/subscriptions/9154cdcb-5a52-452a-b1e7-483be9eee6d2/resourceGroups/RG-ADLS-Governance-Retention/providers/Microsoft.App/containerapps/ca-spa-ia6nebdpvu5bm",
    "ResourceType": "Microsoft.App/containerApps",
    "Source": "Azure"
  },
  {
    "CollectedAt": "2026-04-26T23:40:11.349930+00:00",
    "Collector": "AzureContainers",
    "Data": {
      "ContainerAppId": "/subscriptions/d33fc1a7-56aa-4c30-a4a0-98b1e04fafd0/resourceGroups/ESIQNew-RG/providers/Microsoft.App/containerapps/esiqnew-agent",
      "ContainerCount": 1,
      "IngressAllowInsecure": false,
      "IngressEnabled": true,
      "IngressExternal": true,
      "IngressTargetPort": 8088,
      "IngressTransport": "Auto",
      "Location": "North Europe",
      "ManagedEnvironmentId": "/subscriptions/d33fc1a7-56aa-4c30-a4a0-98b1e04fafd0/resourceGroups/ESIQNew-RG/providers/Microsoft.App/managedEnvironments/ESIQNew-env",
      "ManagedIdentityType": "UserAssigned",
      "Name": "esiqnew-agent",
      "ProvisioningState": "Succeeded",
      "ScaleMaxReplicas": 1,
      "ScaleMinReplicas": 1,
      "SubscriptionId": "d33fc1a7-56aa-4c30-a4a0-98b1e04fafd0",
      "SubscriptionName": "AI"
    },
    "Description": "Container App: esiqnew-agent",
    "EvidenceId": "4eb4b709-007c-558f-92e1-f3e319e4d0c7",
    "EvidenceType": "azure-container-app",
    "RawReference": null,
    "ResourceId": "/subscriptions/d33fc1a7-56aa-4c30-a4a0-98b1e04fafd0/resourceGroups/ESIQNew-RG/providers/Microsoft.App/containerapps/esiqnew-agent",
    "ResourceType": "Microsoft.App/containerApps",
    "Source": "Azure"
  }
]