[
  {
    "CollectedAt": "2026-04-26T23:40:11.542312+00:00",
    "Collector": "AzureCompute",
    "Data": {
      "BootDiagnosticsEnabled": false,
      "DataDiskCount": 0,
      "DataDisksEncrypted": true,
      "HasMDEExtension": true,
      "IdentityType": "SystemAssigned",
      "Location": "eastus2",
      "Name": "AppProxy-Conn",
      "OsDiskEncrypted": false,
      "OsType": "Windows",
      "SubscriptionId": "9154cdcb-5a52-452a-b1e7-483be9eee6d2",
      "SubscriptionName": "Infra",
      "VmId": "/subscriptions/9154cdcb-5a52-452a-b1e7-483be9eee6d2/resourceGroups/APPPROXY-POC-RG/providers/Microsoft.Compute/virtualMachines/AppProxy-Conn",
      "VmSize": "Standard_B2s"
    },
    "Description": "VM: AppProxy-Conn",
    "EvidenceId": "a779b0ff-ff14-5390-a4ab-b41f48652520",
    "EvidenceType": "azure-vm-config",
    "RawReference": null,
    "ResourceId": "/subscriptions/9154cdcb-5a52-452a-b1e7-483be9eee6d2/resourceGroups/APPPROXY-POC-RG/providers/Microsoft.Compute/virtualMachines/AppProxy-Conn",
    "ResourceType": "VirtualMachine",
    "Source": "Azure"
  },
  {
    "CollectedAt": "2026-04-26T23:40:11.542495+00:00",
    "Collector": "AzureCompute",
    "Data": {
      "BootDiagnosticsEnabled": false,
      "DataDiskCount": 0,
      "DataDisksEncrypted": true,
      "HasMDEExtension": true,
      "IdentityType": "SystemAssigned",
      "Location": "eastus2",
      "Name": "IIS-WebServer",
      "OsDiskEncrypted": false,
      "OsType": "Windows",
      "SubscriptionId": "9154cdcb-5a52-452a-b1e7-483be9eee6d2",
      "SubscriptionName": "Infra",
      "VmId": "/subscriptions/9154cdcb-5a52-452a-b1e7-483be9eee6d2/resourceGroups/APPPROXY-POC-RG/providers/Microsoft.Compute/virtualMachines/IIS-WebServer",
      "VmSize": "Standard_B2s"
    },
    "Description": "VM: IIS-WebServer",
    "EvidenceId": "c1b3ab5d-90a2-5e67-a38e-af06b682f6c3",
    "EvidenceType": "azure-vm-config",
    "RawReference": null,
    "ResourceId": "/subscriptions/9154cdcb-5a52-452a-b1e7-483be9eee6d2/resourceGroups/APPPROXY-POC-RG/providers/Microsoft.Compute/virtualMachines/IIS-WebServer",
    "ResourceType": "VirtualMachine",
    "Source": "Azure"
  },
  {
    "CollectedAt": "2026-04-26T23:40:11.542689+00:00",
    "Collector": "AzureCompute",
    "Data": {
      "BootDiagnosticsEnabled": true,
      "DataDiskCount": 0,
      "DataDisksEncrypted": true,
      "HasMDEExtension": true,
      "IdentityType": "SystemAssigned",
      "Location": "westus2",
      "Name": "vm-ecma2poc",
      "OsDiskEncrypted": false,
      "OsType": "Windows",
      "SubscriptionId": "9154cdcb-5a52-452a-b1e7-483be9eee6d2",
      "SubscriptionName": "Infra",
      "VmId": "/subscriptions/9154cdcb-5a52-452a-b1e7-483be9eee6d2/resourceGroups/RG-ECMA2-POC-WUS2/providers/Microsoft.Compute/virtualMachines/vm-ecma2poc",
      "VmSize": "Standard_B2ms"
    },
    "Description": "VM: vm-ecma2poc",
    "EvidenceId": "5be8a321-67c8-59e1-8315-d475a080d08d",
    "EvidenceType": "azure-vm-config",
    "RawReference": null,
    "ResourceId": "/subscriptions/9154cdcb-5a52-452a-b1e7-483be9eee6d2/resourceGroups/RG-ECMA2-POC-WUS2/providers/Microsoft.Compute/virtualMachines/vm-ecma2poc",
    "ResourceType": "VirtualMachine",
    "Source": "Azure"
  },
  {
    "CollectedAt": "2026-04-26T23:40:11.542569+00:00",
    "Collector": "AzureCompute",
    "Data": {
      "BootDiagnosticsEnabled": true,
      "DataDiskCount": 0,
      "DataDisksEncrypted": true,
      "HasMDEExtension": true,
      "IdentityType": "SystemAssigned",
      "Location": "eastus2",
      "Name": "vm01",
      "OsDiskEncrypted": false,
      "OsType": "Windows",
      "SubscriptionId": "9154cdcb-5a52-452a-b1e7-483be9eee6d2",
      "SubscriptionName": "Infra",
      "VmId": "/subscriptions/9154cdcb-5a52-452a-b1e7-483be9eee6d2/resourceGroups/RG-POC-SENTINEL/providers/Microsoft.Compute/virtualMachines/vm01",
      "VmSize": "Standard_DS1_v2"
    },
    "Description": "VM: vm01",
    "EvidenceId": "68e6e051-05d9-5e24-ac5d-a138f2e4221c",
    "EvidenceType": "azure-vm-config",
    "RawReference": null,
    "ResourceId": "/subscriptions/9154cdcb-5a52-452a-b1e7-483be9eee6d2/resourceGroups/RG-POC-SENTINEL/providers/Microsoft.Compute/virtualMachines/vm01",
    "ResourceType": "VirtualMachine",
    "Source": "Azure"
  },
  {
    "CollectedAt": "2026-04-26T23:40:11.542632+00:00",
    "Collector": "AzureCompute",
    "Data": {
      "BootDiagnosticsEnabled": true,
      "DataDiskCount": 0,
      "DataDisksEncrypted": true,
      "HasMDEExtension": true,
      "IdentityType": "SystemAssigned",
      "Location": "eastus2",
      "Name": "vm02",
      "OsDiskEncrypted": false,
      "OsType": "Windows",
      "SubscriptionId": "9154cdcb-5a52-452a-b1e7-483be9eee6d2",
      "SubscriptionName": "Infra",
      "VmId": "/subscriptions/9154cdcb-5a52-452a-b1e7-483be9eee6d2/resourceGroups/VM02_GROUP/providers/Microsoft.Compute/virtualMachines/vm02",
      "VmSize": "Standard_DS1_v2"
    },
    "Description": "VM: vm02",
    "EvidenceId": "42d3a9a3-f4b0-5a10-9912-278c8a7b4b39",
    "EvidenceType": "azure-vm-config",
    "RawReference": null,
    "ResourceId": "/subscriptions/9154cdcb-5a52-452a-b1e7-483be9eee6d2/resourceGroups/VM02_GROUP/providers/Microsoft.Compute/virtualMachines/vm02",
    "ResourceType": "VirtualMachine",
    "Source": "Azure"
  }
]