[
  {
    "CollectedAt": "2026-04-26T23:33:01.772992+00:00",
    "Collector": "AzureDefenderPlans",
    "Data": {
      "AutoProvision": "Off",
      "IsEnabled": false,
      "Name": "default",
      "SubscriptionId": "0eb177bd-28b1-44da-b683-1508e1268aee",
      "SubscriptionName": "Prod"
    },
    "Description": "Auto-provisioning: default",
    "EvidenceId": "7386d0be-b1da-583a-8998-b1152868ef35",
    "EvidenceType": "azure-auto-provisioning",
    "RawReference": null,
    "ResourceId": "/subscriptions/0eb177bd-28b1-44da-b683-1508e1268aee/providers/Microsoft.Security/autoProvisioningSettings/default",
    "ResourceType": "AutoProvisioning",
    "Source": "Azure"
  },
  {
    "CollectedAt": "2026-04-26T23:33:06.873686+00:00",
    "Collector": "AzureDefenderPlans",
    "Data": {
      "AutoProvision": "Off",
      "IsEnabled": false,
      "Name": "default",
      "SubscriptionId": "8054e434-49e0-4a21-bbea-3fee1c872b88",
      "SubscriptionName": "Security"
    },
    "Description": "Auto-provisioning: default",
    "EvidenceId": "c0e137e6-b2b3-5d30-83ae-4872f5ba5309",
    "EvidenceType": "azure-auto-provisioning",
    "RawReference": null,
    "ResourceId": "/subscriptions/8054e434-49e0-4a21-bbea-3fee1c872b88/providers/Microsoft.Security/autoProvisioningSettings/default",
    "ResourceType": "AutoProvisioning",
    "Source": "Azure"
  },
  {
    "CollectedAt": "2026-04-26T23:33:16.036728+00:00",
    "Collector": "AzureDefenderPlans",
    "Data": {
      "AutoProvision": "Off",
      "IsEnabled": false,
      "Name": "default",
      "SubscriptionId": "9154cdcb-5a52-452a-b1e7-483be9eee6d2",
      "SubscriptionName": "Infra"
    },
    "Description": "Auto-provisioning: default",
    "EvidenceId": "d8614576-f2a3-5e5d-9043-bf578940d953",
    "EvidenceType": "azure-auto-provisioning",
    "RawReference": null,
    "ResourceId": "/subscriptions/9154cdcb-5a52-452a-b1e7-483be9eee6d2/providers/Microsoft.Security/autoProvisioningSettings/default",
    "ResourceType": "AutoProvisioning",
    "Source": "Azure"
  },
  {
    "CollectedAt": "2026-04-26T23:33:21.814792+00:00",
    "Collector": "AzureDefenderPlans",
    "Data": {
      "AutoProvision": "Off",
      "IsEnabled": false,
      "Name": "default",
      "SubscriptionId": "d33fc1a7-56aa-4c30-a4a0-98b1e04fafd0",
      "SubscriptionName": "AI"
    },
    "Description": "Auto-provisioning: default",
    "EvidenceId": "d6399a28-5403-5666-aa84-e7641fdeb8a9",
    "EvidenceType": "azure-auto-provisioning",
    "RawReference": null,
    "ResourceId": "/subscriptions/d33fc1a7-56aa-4c30-a4a0-98b1e04fafd0/providers/Microsoft.Security/autoProvisioningSettings/default",
    "ResourceType": "AutoProvisioning",
    "Source": "Azure"
  }
]