[
  {
    "CollectedAt": "2026-04-26T23:33:26.422381+00:00",
    "Collector": "AzureActivityLogs",
    "Data": {
      "DeleteOps": 0,
      "FailedOps": 12,
      "SubscriptionId": "0eb177bd-28b1-44da-b683-1508e1268aee",
      "SubscriptionName": "Prod",
      "TotalEvents": 2363,
      "WriteOps": 1288
    },
    "Description": "Activity logs summary for Prod",
    "EvidenceId": "8d763ea3-6417-5b9f-95c1-bef48df336ca",
    "EvidenceType": "azure-activity-log",
    "RawReference": null,
    "ResourceId": "/subscriptions/0eb177bd-28b1-44da-b683-1508e1268aee",
    "ResourceType": "ActivityLog",
    "Source": "Azure"
  },
  {
    "CollectedAt": "2026-04-26T23:34:20.157614+00:00",
    "Collector": "AzureActivityLogs",
    "Data": {
      "DeleteOps": 0,
      "FailedOps": 24,
      "SubscriptionId": "8054e434-49e0-4a21-bbea-3fee1c872b88",
      "SubscriptionName": "Security",
      "TotalEvents": 2622,
      "WriteOps": 1435
    },
    "Description": "Activity logs summary for Security",
    "EvidenceId": "a15ab4d5-e679-5efa-bd06-caafd82dc970",
    "EvidenceType": "azure-activity-log",
    "RawReference": null,
    "ResourceId": "/subscriptions/8054e434-49e0-4a21-bbea-3fee1c872b88",
    "ResourceType": "ActivityLog",
    "Source": "Azure"
  },
  {
    "CollectedAt": "2026-04-26T23:36:18.126119+00:00",
    "Collector": "AzureActivityLogs",
    "Data": {
      "DeleteOps": 13,
      "FailedOps": 177,
      "SubscriptionId": "9154cdcb-5a52-452a-b1e7-483be9eee6d2",
      "SubscriptionName": "Infra",
      "TotalEvents": 10000,
      "WriteOps": 1332
    },
    "Description": "Activity logs summary for Infra",
    "EvidenceId": "a72ac03e-e3c4-545b-8550-87522ee5139f",
    "EvidenceType": "azure-activity-log",
    "RawReference": null,
    "ResourceId": "/subscriptions/9154cdcb-5a52-452a-b1e7-483be9eee6d2",
    "ResourceType": "ActivityLog",
    "Source": "Azure"
  },
  {
    "CollectedAt": "2026-04-26T23:39:14.933703+00:00",
    "Collector": "AzureActivityLogs",
    "Data": {
      "DeleteOps": 188,
      "FailedOps": 3177,
      "SubscriptionId": "d33fc1a7-56aa-4c30-a4a0-98b1e04fafd0",
      "SubscriptionName": "AI",
      "TotalEvents": 10000,
      "WriteOps": 3812
    },
    "Description": "Activity logs summary for AI",
    "EvidenceId": "dd65fffe-a212-5666-afef-c12c3a7f8dc0",
    "EvidenceType": "azure-activity-log",
    "RawReference": null,
    "ResourceId": "/subscriptions/d33fc1a7-56aa-4c30-a4a0-98b1e04fafd0",
    "ResourceType": "ActivityLog",
    "Source": "Azure"
  }
]